{
  "schema_version": 1,
  "artifact_id": "dm70-m04",
  "course": "digital-marketing-70h",
  "output": "output/pdf/digital-marketing-70h/DM70-M04-社群行銷.pdf",
  "profile": "course-manager/pdf-profiles/digital-marketing-70h.css",
  "sources": [
    {
      "path": "digital-marketing-70h/m4-1-attention.html",
      "selectors": [
        ".lesson-hero",
        ".lesson-body"
      ],
      "source_url": "https://skypai0326.github.io/courses/courses/digital-marketing-70h/m4-1-attention.html",
      "static_content_confirmed": true
    },
    {
      "path": "digital-marketing-70h/m4-2-platforms.html",
      "selectors": [
        ".lesson-hero",
        ".lesson-body"
      ],
      "source_url": "https://skypai0326.github.io/courses/courses/digital-marketing-70h/m4-2-platforms.html",
      "static_content_confirmed": true
    },
    {
      "path": "digital-marketing-70h/m4-3-shortform.html",
      "selectors": [
        ".lesson-hero",
        ".lesson-body"
      ],
      "source_url": "https://skypai0326.github.io/courses/courses/digital-marketing-70h/m4-3-shortform.html",
      "static_content_confirmed": true
    },
    {
      "path": "digital-marketing-70h/m4-4-management.html",
      "selectors": [
        ".lesson-hero",
        ".lesson-body"
      ],
      "source_url": "https://skypai0326.github.io/courses/courses/digital-marketing-70h/m4-4-management.html",
      "static_content_confirmed": true
    },
    {
      "path": "digital-marketing-70h/m4-5-kol.html",
      "selectors": [
        ".lesson-hero",
        ".lesson-body"
      ],
      "source_url": "https://skypai0326.github.io/courses/courses/digital-marketing-70h/m4-5-kol.html",
      "static_content_confirmed": true
    }
  ],
  "font_files": [
    "/Library/Fonts/Arial Unicode.ttf"
  ],
  "exclude": [
    {
      "selector": "button.copy-btn,button.prompt-copy-btn,button.step-example-copy,button[data-copy],button[data-policy-copy],button.btn-drill-copy",
      "reason": "僅供網頁複製原文的按鈕，教材文字保留在原有文字區塊。"
    }
  ],
  "expand": [],
  "dependencies": [],
  "remote_assets": {},
  "notes": "以現行課程首頁或Module頁的實際單元順序對照原PDF範圍；教學正文已存在HTML，scripts為Gate、複製與捲動。"
}