{
  "schema_version": 1,
  "artifact_id": "admin-ai-ch03",
  "course": "admin-ai-assistant",
  "output": "output/pdf/admin-ai-assistant/ADMIN-AI-CH03-Email-公文與行政通知撰寫.pdf",
  "profile": "course-manager/pdf-profiles/admin-ai-assistant.css",
  "sources": [
    {
      "path": "admin-ai-assistant/CH3.html",
      "selectors": [
        "main#main"
      ],
      "source_url": "https://skypai0326.github.io/courses/courses/admin-ai-assistant/CH3.html",
      "static_content_confirmed": true
    }
  ],
  "font_files": [
    "/Library/Fonts/Arial Unicode.ttf"
  ],
  "exclude": [
    {
      "selector": "button.copy-btn,button.prompt-copy-btn,button.step-example-copy,button[data-copy],button[data-policy-copy],button.btn-drill-copy",
      "reason": "僅供網頁複製原文的按鈕，教材文字保留在原有文字區塊。"
    }
  ],
  "expand": [],
  "dependencies": [],
  "remote_assets": {},
  "notes": "以現行課程首頁或Module頁的實際單元順序對照原PDF範圍；教學正文已存在HTML，scripts為Gate、複製與捲動。"
}