{
  "schema_version": 1,
  "artifact_id": "office-ai-print",
  "course": "office-ai",
  "output": "output/pdf/office-ai/office-ai-講義-印刷版.pdf",
  "profile": "course-manager/pdf-profiles/office-ai.css",
  "sources": [
    {
      "path": "office-ai/ch1/CH1-1.html",
      "selectors": [
        ".lesson-hero",
        ".lesson-body"
      ],
      "source_url": "https://skypai0326.github.io/courses/courses/office-ai/ch1/CH1-1.html",
      "static_content_confirmed": true
    },
    {
      "path": "office-ai/ch1/CH1-2.html",
      "selectors": [
        ".lesson-hero",
        ".lesson-body"
      ],
      "source_url": "https://skypai0326.github.io/courses/courses/office-ai/ch1/CH1-2.html",
      "static_content_confirmed": true
    },
    {
      "path": "office-ai/ch1/CH1-3.html",
      "selectors": [
        ".lesson-hero",
        ".lesson-body"
      ],
      "source_url": "https://skypai0326.github.io/courses/courses/office-ai/ch1/CH1-3.html",
      "static_content_confirmed": true
    },
    {
      "path": "office-ai/ch1/CH1-4.html",
      "selectors": [
        ".lesson-hero",
        ".lesson-body"
      ],
      "source_url": "https://skypai0326.github.io/courses/courses/office-ai/ch1/CH1-4.html",
      "static_content_confirmed": true
    },
    {
      "path": "office-ai/ch2/CH2-1.html",
      "selectors": [
        ".lesson-hero",
        ".lesson-body"
      ],
      "source_url": "https://skypai0326.github.io/courses/courses/office-ai/ch2/CH2-1.html",
      "static_content_confirmed": true
    },
    {
      "path": "office-ai/ch2/CH2-2.html",
      "selectors": [
        ".lesson-hero",
        ".lesson-body"
      ],
      "source_url": "https://skypai0326.github.io/courses/courses/office-ai/ch2/CH2-2.html",
      "static_content_confirmed": true
    },
    {
      "path": "office-ai/ch2/CH2-3.html",
      "selectors": [
        ".lesson-hero",
        ".lesson-body"
      ],
      "source_url": "https://skypai0326.github.io/courses/courses/office-ai/ch2/CH2-3.html",
      "static_content_confirmed": true
    },
    {
      "path": "office-ai/ch3/CH3-1.html",
      "selectors": [
        ".lesson-hero",
        ".lesson-body"
      ],
      "source_url": "https://skypai0326.github.io/courses/courses/office-ai/ch3/CH3-1.html",
      "static_content_confirmed": true
    },
    {
      "path": "office-ai/ch3/CH3-2.html",
      "selectors": [
        ".lesson-hero",
        ".lesson-body"
      ],
      "source_url": "https://skypai0326.github.io/courses/courses/office-ai/ch3/CH3-2.html",
      "static_content_confirmed": true
    },
    {
      "path": "office-ai/ch3/CH3-3.html",
      "selectors": [
        ".lesson-hero",
        ".lesson-body"
      ],
      "source_url": "https://skypai0326.github.io/courses/courses/office-ai/ch3/CH3-3.html",
      "static_content_confirmed": true
    },
    {
      "path": "office-ai/ch4/CH4-1.html",
      "selectors": [
        ".lesson-hero",
        ".lesson-body"
      ],
      "source_url": "https://skypai0326.github.io/courses/courses/office-ai/ch4/CH4-1.html",
      "static_content_confirmed": true
    },
    {
      "path": "office-ai/ch4/CH4-2.html",
      "selectors": [
        ".lesson-hero",
        ".lesson-body"
      ],
      "source_url": "https://skypai0326.github.io/courses/courses/office-ai/ch4/CH4-2.html",
      "static_content_confirmed": true
    },
    {
      "path": "office-ai/ch4/CH4-3.html",
      "selectors": [
        ".lesson-hero",
        ".lesson-body"
      ],
      "source_url": "https://skypai0326.github.io/courses/courses/office-ai/ch4/CH4-3.html",
      "static_content_confirmed": true
    },
    {
      "path": "office-ai/ch5/CH5-1.html",
      "selectors": [
        ".lesson-hero",
        ".lesson-body"
      ],
      "source_url": "https://skypai0326.github.io/courses/courses/office-ai/ch5/CH5-1.html",
      "static_content_confirmed": true
    },
    {
      "path": "office-ai/ch5/CH5-2.html",
      "selectors": [
        ".lesson-hero",
        ".lesson-body"
      ],
      "source_url": "https://skypai0326.github.io/courses/courses/office-ai/ch5/CH5-2.html",
      "static_content_confirmed": true
    },
    {
      "path": "office-ai/ch5/CH5-3.html",
      "selectors": [
        ".lesson-hero",
        ".lesson-body"
      ],
      "source_url": "https://skypai0326.github.io/courses/courses/office-ai/ch5/CH5-3.html",
      "static_content_confirmed": true
    },
    {
      "path": "office-ai/ch6/CH6-1.html",
      "selectors": [
        ".lesson-hero",
        ".lesson-body"
      ],
      "source_url": "https://skypai0326.github.io/courses/courses/office-ai/ch6/CH6-1.html",
      "static_content_confirmed": true
    },
    {
      "path": "office-ai/ch6/CH6-2.html",
      "selectors": [
        ".lesson-hero",
        ".lesson-body"
      ],
      "source_url": "https://skypai0326.github.io/courses/courses/office-ai/ch6/CH6-2.html",
      "static_content_confirmed": true
    },
    {
      "path": "office-ai/ch6/CH6-3.html",
      "selectors": [
        ".lesson-hero",
        ".lesson-body"
      ],
      "source_url": "https://skypai0326.github.io/courses/courses/office-ai/ch6/CH6-3.html",
      "static_content_confirmed": true
    }
  ],
  "font_files": [
    "/Library/Fonts/Arial Unicode.ttf"
  ],
  "exclude": [
    {
      "selector": "button.copy-btn,button.prompt-copy-btn,button.step-example-copy,button[data-copy],button[data-policy-copy],button.btn-drill-copy",
      "reason": "僅供網頁複製原文的按鈕，教材文字保留在原有文字區塊。"
    }
  ],
  "expand": [],
  "dependencies": [],
  "remote_assets": {},
  "notes": "以現行課程首頁或Module頁的實際單元順序對照原PDF範圍；教學正文已存在HTML，scripts為Gate、複製與捲動。"
}