{
  "schema_version": 1,
  "artifact_id": "simple-ai-quick-reference",
  "course": "simple-ai",
  "output": "output/pdf/simple-ai/創業-AI-實戰-10則Prompt精選.pdf",
  "profile": "course-manager/pdf-profiles/default.css",
  "sources": [
    {
      "path": "simple-ai/quick-reference.html",
      "selectors": [
        ".quick-page"
      ],
      "source_url": "https://skypai0326.github.io/courses/courses/simple-ai/quick-reference.html",
      "static_content_confirmed": true
    }
  ],
  "font_files": [
    "/Library/Fonts/Arial Unicode.ttf"
  ],
  "exclude": [],
  "expand": [],
  "dependencies": [],
  "remote_assets": {},
  "notes": "保留现存网页速查版两页全部原文；仅有密码脚本，无教学内容动态生成。"
}