{
  "schema_version": 1,
  "artifact_id": "dm70-m02",
  "course": "digital-marketing-70h",
  "output": "output/pdf/digital-marketing-70h/DM70-M02-生成式-AI-完整體系.pdf",
  "profile": "course-manager/pdf-profiles/digital-marketing-70h.css",
  "sources": [
    {
      "path": "digital-marketing-70h/m2a-1-llm.html",
      "selectors": [
        ".lesson-hero",
        ".lesson-body"
      ],
      "source_url": "https://skypai0326.github.io/courses/courses/digital-marketing-70h/m2a-1-llm.html",
      "static_content_confirmed": true
    },
    {
      "path": "digital-marketing-70h/m2a-2-tools.html",
      "selectors": [
        ".lesson-hero",
        ".lesson-body"
      ],
      "source_url": "https://skypai0326.github.io/courses/courses/digital-marketing-70h/m2a-2-tools.html",
      "static_content_confirmed": true
    },
    {
      "path": "digital-marketing-70h/m2a-3-limits.html",
      "selectors": [
        ".lesson-hero",
        ".lesson-body"
      ],
      "source_url": "https://skypai0326.github.io/courses/courses/digital-marketing-70h/m2a-3-limits.html",
      "static_content_confirmed": true
    },
    {
      "path": "digital-marketing-70h/m2b-1-structure.html",
      "selectors": [
        ".lesson-hero",
        ".lesson-body"
      ],
      "source_url": "https://skypai0326.github.io/courses/courses/digital-marketing-70h/m2b-1-structure.html",
      "static_content_confirmed": true
    },
    {
      "path": "digital-marketing-70h/m2b-2-advanced.html",
      "selectors": [
        ".lesson-hero",
        ".lesson-body"
      ],
      "source_url": "https://skypai0326.github.io/courses/courses/digital-marketing-70h/m2b-2-advanced.html",
      "static_content_confirmed": true
    },
    {
      "path": "digital-marketing-70h/m2b-3-library.html",
      "selectors": [
        ".lesson-hero",
        ".lesson-body"
      ],
      "source_url": "https://skypai0326.github.io/courses/courses/digital-marketing-70h/m2b-3-library.html",
      "static_content_confirmed": true
    },
    {
      "path": "digital-marketing-70h/m2c-1-text.html",
      "selectors": [
        ".lesson-hero",
        ".lesson-body"
      ],
      "source_url": "https://skypai0326.github.io/courses/courses/digital-marketing-70h/m2c-1-text.html",
      "static_content_confirmed": true
    },
    {
      "path": "digital-marketing-70h/m2c-2-visual.html",
      "selectors": [
        ".lesson-hero",
        ".lesson-body"
      ],
      "source_url": "https://skypai0326.github.io/courses/courses/digital-marketing-70h/m2c-2-visual.html",
      "static_content_confirmed": true
    },
    {
      "path": "digital-marketing-70h/m2c-3-video.html",
      "selectors": [
        ".lesson-hero",
        ".lesson-body"
      ],
      "source_url": "https://skypai0326.github.io/courses/courses/digital-marketing-70h/m2c-3-video.html",
      "static_content_confirmed": true
    },
    {
      "path": "digital-marketing-70h/m2d-1-research.html",
      "selectors": [
        ".lesson-hero",
        ".lesson-body"
      ],
      "source_url": "https://skypai0326.github.io/courses/courses/digital-marketing-70h/m2d-1-research.html",
      "static_content_confirmed": true
    },
    {
      "path": "digital-marketing-70h/m2d-2-workflow.html",
      "selectors": [
        ".lesson-hero",
        ".lesson-body"
      ],
      "source_url": "https://skypai0326.github.io/courses/courses/digital-marketing-70h/m2d-2-workflow.html",
      "static_content_confirmed": true
    },
    {
      "path": "digital-marketing-70h/m2d-3-strategy.html",
      "selectors": [
        ".lesson-hero",
        ".lesson-body"
      ],
      "source_url": "https://skypai0326.github.io/courses/courses/digital-marketing-70h/m2d-3-strategy.html",
      "static_content_confirmed": true
    }
  ],
  "font_files": [
    "/Library/Fonts/Arial Unicode.ttf"
  ],
  "exclude": [
    {
      "selector": "button.copy-btn,button.prompt-copy-btn,button.step-example-copy,button[data-copy],button[data-policy-copy],button.btn-drill-copy",
      "reason": "僅供網頁複製原文的按鈕，教材文字保留在原有文字區塊。"
    }
  ],
  "expand": [],
  "dependencies": [],
  "remote_assets": {},
  "notes": "以現行課程首頁或Module頁的實際單元順序對照原PDF範圍；教學正文已存在HTML，scripts為Gate、複製與捲動。"
}