{
  "schema_version": 1,
  "artifact_id": "ccs-full",
  "course": "ccs-foundations",
  "output": "output/pdf/ccs-foundations/CCS-認證研習-完整版講義.pdf",
  "profile": "course-manager/pdf-profiles/default.css",
  "sources": [
    {
      "path": "ccs-foundations/CH1-1-v2.html",
      "selectors": [
        "main#main"
      ],
      "source_url": "https://skypai0326.github.io/courses/courses/ccs-foundations/CH1-1-v2.html",
      "static_content_confirmed": true
    },
    {
      "path": "ccs-foundations/CH1-2-v2.html",
      "selectors": [
        "main#main"
      ],
      "source_url": "https://skypai0326.github.io/courses/courses/ccs-foundations/CH1-2-v2.html",
      "static_content_confirmed": true
    },
    {
      "path": "ccs-foundations/CH1-3-v2.html",
      "selectors": [
        "main#main"
      ],
      "source_url": "https://skypai0326.github.io/courses/courses/ccs-foundations/CH1-3-v2.html",
      "static_content_confirmed": true
    },
    {
      "path": "ccs-foundations/CH1-4-v2.html",
      "selectors": [
        "main#main"
      ],
      "source_url": "https://skypai0326.github.io/courses/courses/ccs-foundations/CH1-4-v2.html",
      "static_content_confirmed": true
    },
    {
      "path": "ccs-foundations/PRAC1-v2.html",
      "selectors": [
        "main#main"
      ],
      "source_url": "https://skypai0326.github.io/courses/courses/ccs-foundations/PRAC1-v2.html",
      "static_content_confirmed": true
    },
    {
      "path": "ccs-foundations/CH2-1-v2.html",
      "selectors": [
        "main#main"
      ],
      "source_url": "https://skypai0326.github.io/courses/courses/ccs-foundations/CH2-1-v2.html",
      "static_content_confirmed": true
    },
    {
      "path": "ccs-foundations/CH2-2-v2.html",
      "selectors": [
        "main#main"
      ],
      "source_url": "https://skypai0326.github.io/courses/courses/ccs-foundations/CH2-2-v2.html",
      "static_content_confirmed": true
    },
    {
      "path": "ccs-foundations/CH2-3-v2.html",
      "selectors": [
        "main#main"
      ],
      "source_url": "https://skypai0326.github.io/courses/courses/ccs-foundations/CH2-3-v2.html",
      "static_content_confirmed": true
    },
    {
      "path": "ccs-foundations/CH2-4-v2.html",
      "selectors": [
        "main#main"
      ],
      "source_url": "https://skypai0326.github.io/courses/courses/ccs-foundations/CH2-4-v2.html",
      "static_content_confirmed": true
    }
  ],
  "font_files": [
    "/Library/Fonts/Arial Unicode.ttf"
  ],
  "exclude": [
    {
      "selector": "button.copy-btn,button.prompt-copy-btn,button.step-example-copy,button[data-copy],button[data-policy-copy],button.btn-drill-copy",
      "reason": "僅供網頁複製原文的按鈕，教材文字保留在原有文字區塊。"
    }
  ],
  "expand": [],
  "dependencies": [],
  "remote_assets": {},
  "notes": "以現行課程首頁或Module頁的實際單元順序對照原PDF範圍；教學正文已存在HTML，scripts為Gate、複製與捲動。"
}