{
  "schema_version": 1,
  "artifact_id": "gen-image-skeleton-quick-card",
  "course": "gen-image",
  "output": "output/pdf/gen-image/商業圖片生成-L2線稿骨架快速卡.pdf",
  "profile": "course-manager/pdf-profiles/default.css",
  "sources": [
    {
      "path": "gen-image/assets/downloads/skeleton-quick-card.html",
      "selectors": [
        ".page"
      ],
      "source_url": "https://skypai0326.github.io/courses/courses/gen-image/assets/downloads/skeleton-quick-card.html",
      "static_content_confirmed": true
    }
  ],
  "font_files": [
    "/Library/Fonts/Arial Unicode.ttf"
  ],
  "exclude": [],
  "expand": [],
  "dependencies": [],
  "remote_assets": {},
  "notes": "A4 雙面 L2 線稿骨架快速卡；HTML 為內容真相源，完整保留兩頁原文。"
}
